[{"id":20,"name":"专利","handle":"20.500.11897/413921","type":"community","link":"/rest/communities/20","expand":["parentCommunity","collections","subCommunities","logo","all"],"logo":null,"parentCommunity":null,"copyrightText":"","introductoryText":"","shortDescription":"","sidebarText":"","countItems":25721,"subcommunities":[],"collections":[]},{"id":5,"name":"人文学部","handle":"20.500.11897/5","type":"community","link":"/rest/communities/5","expand":["parentCommunity","collections","subCommunities","logo","all"],"logo":null,"parentCommunity":null,"copyrightText":"","introductoryText":"","shortDescription":"Humanities","sidebarText":"","countItems":48230,"subcommunities":[],"collections":[]}]